{
  "format": "seydlitz.character",
  "formatVersion": 1,
  "id": "01a10b11-5548-7ede-bc93-5138076db170",
  "system": "dh1",
  "sheetVersion": 4,
  "name": "Аколит Вэйн",
  "createdAt": "2026-10-05T10:00:00Z",
  "updatedAt": "2026-10-05T10:00:00Z",
  "author": { "id": "01a10b11-5548-7ede-bc93-5138076db171", "name": "Игрок" },
  "sheet": {
    "homeworld": { "id": "test-forge" },
    "career": { "id": "test-scribe" },
    "rank": { "custom": "Младший архивариус" },
    "characteristics": { "int": { "base": 35, "advances": 1 } },
    "skills": [
      { "skill": "test-notice" },
      { "skill": "test-lore", "specialization": { "id": "test-lore-archives" }, "training": 2 },
      { "skill": "test-lore", "specialization": { "custom": "Ереси сектора" } }
    ]
  }
}
